date,press,category,headline,url,text,topics,labels,cnt
2019/03/29,세계일보,정치,"[사설] 4월 한·미 정상회담, 북핵 공조 불협화음 잠재워야",http://www.segye.com/content/html/2019/03/29/20190329511257.html,"‘하노이 노딜’ 이후 첫 정상 만남 / 北 완전 비핵화 목표 이루려면 / 양국 협력 통한 압박 강화 절실문재인 대통령과 도널드 트럼프 미국 대통령이 다음달 11일 미국 워싱턴에서 한·미 정상회담을 한다. ‘하노이 노딜’ 이후 40여일 만이다. 청와대는 어제 “한·미동맹 관계를 더 강화하고 완전한 비핵화를 통한 한반도 평화체제를 구축하기 위해 양국 간 공조 방안에 대해 심도 있는 협의를 할 예정”이라고 밝혔다. 백악관은 한·미 정상회담 일정을 발표하면서 “한·미동맹은 한반도와 그 지역의 평화와 안전의 린치핀(핵심축)으로 남아 있다”고 했다. 두 정상은 북·미 교착 국면을 타개하고 협상 동력을 살리는 톱다운 해법을 모색할 것이라고 한다. 이번 정상회담의 가장 시급한 의제는 양국 간 대북 공조와 동맹 관계를 굳건히 다지는 일이다. 양국은 하노이 북·미 정상회담 결렬 이후 북핵 해법을 놓고 시각차를 드러내고 있다. 트럼프 대통령은 회담 직후 “영변 해체는 완전한 비핵화가 아니다”고 밝혔다. 반면 문 대통령은 “영변 핵시설이 완전 폐기된다면 비핵화는 되돌릴 수 없는 단계로 접어든다”고 했다. 심지어 외교안보 관계 장관들에게는 “남북협력사업들을 속도감 있게 준비해 달라”고 지시했고, 3·1절 기념사에선 금강산관광·개성공단 재개 의지를 밝혔다. 미국에서 한국을 믿을 수 있느냐는 소리가 공공연하게 나오는 이유다. 미국 조야에선 하노이 회담 결렬과 관련해 동맹국인 한국에 속았다는 비난까지 제기된다. 청와대가 한국 역할을 북·미 협상의 중재자·촉진자로 규정한 데 대한 회의적 시각이 적지 않다. 문 대통령이 핵무기로 위협하는 김정은 북한 국무위원장을 설득하지 않고 되레 미국을 설득하려 한다는 것이다. 북한이 이런 기회를 놓칠 리 없다. 각종 선전매체들을 통해 “문 대통령은 중재자가 아니다”며 한·미 사이를 이간질한다. 북한 비핵화를 위해선 북한과 미국을 협상 테이블로 다시 불러들이는 한국의 역할이 중요하다. 한·미 정상회담에서 문 대통령이 미국의 ‘일괄타결식 빅딜론’과 북한의 ‘단계적 접근론’의 간극을 좁힐 수 있는 방안을 제시할지가 관심사다. 이런 방안이 긍정적으로 논의되면 남북정상회담으로 이어질 수 있을 것이다. 하지만 우리가 단순한 중재자를 넘어 북핵 문제 당사자임을 잊지 말아야 한다. 김 위원장이 판문점선언에서 완전한 비핵화를 약속해놓고 1년이 다 되도록 핵시설 신고조차 회피하는 행태는 핵 폐기 의지를 의심케 한다. 북한이 핵을 포기하게 하려면 대북제재 고삐를 늦춰선 안 된다. 한·미 간 대북 공조 강화는 필수 과제다. 문 대통령은 이번 정상회담을 통해 한·미 동맹관계를 견고히 다져 다시는 불협화음이 나오지 않도록 해야 한다. 한·미는 29일 외교장관 회담에 이어 내달 1일 국방장관 회담을 연다. 김현종 청와대 국가안보실 제2차장은 내주 방미해 백악관 관계자들과 만난다. 이런 연쇄 협의를 통해 사전 조율 작업을 치밀하게 해야 한·미 정상회담에서 가시적인 성과를 거둘 수 있을 것이다.[ⓒ 세계일보 & Segye.com, 무단전재 및 재배포 금지]","회담, 핵, 미, 정상, 대통령, 미국, 한, 북한, 북, 문",0,94
2019/03/29,중앙일보,"정치,국제","한·미 정상회담 4월10~11일…백악관 ""한·미 동맹은 린치핀""",https://news.joins.com/article/olink/23018316,"문재인 대통령과 도널드 트럼프 미국 대통령 간 한미정상회담이 다음달 10~11일 미국 워싱턴에서 열린다.   윤도한 국민소통수석은 29일 오전 춘추관 브리핑에서 “문 대통령 내외는 트럼프 대통령 내외의 초청으로 4월10일~11일 워싱턴을 방문한다”고 말했다. 1박2일 일정이다.   문재인 대통령과 트럼프 대통령 간 정상회담은 유엔총회나 주요 20개국 회의(G20) 등 다자회의에서의 만남을 포함하면 이번이 7번째다. 지난해 11월30일 아르헨티나 부에노스아이레스에서 열린 G20 정상회의 이후 4개월 여 만이기도 하다.   백악관도 이날 성명에서 ""트럼프 대통령과 멜라니아 여사가 4월11일 백악관에서 문재인 대통령과 김정숙 여사를 환영할 것""이라면서 이번 회담에서 ""양자 현안뿐 아니라 북한과 관련해 최근 전개된 사안들에 대해서도 논의할 예정""이라고 설명했다.   백악관은 특히 ""한미동맹은 한반도와 그 지역의 평화와 안전의 린치핀(linchpin·핵심축)으로 남아있다""며 ""이번 방문은 이 동맹과 양국 간의 우정을 강화하게 될 것""이라고 말했다.    미국은 과거 굳건한 한·미 동맹을 상징하는 용어로 쓰여 온 ‘린치핀(linchpin·핵심 축)’을 자주 사용했으나 트럼프 행정부 출범 이후에는 거의 쓰지 않았다. 이 때문에 이번 성명에서 '린치핀'을 쓴 것은 최근 한미관계를 둘러싸고 이상기류가 나타나고 있다는 관측을 불식시키려는 의도로 풀이된다.   실제로 그동안 외교가에선 하노이 회담 직후 추진되던 한미정상회담이 늦어지면서 그 시기에 대한 궁금증이 컸다. 하노이 회담 직후인 지난달 28일 청와대 김의겸 대변인은 ""문 대통령은 트럼프 대통령과 전화통화를 갖고 '가까운 시일 안에 직접 만나 보다 심도 있는 협의를 계속해 나가자'고 했고, 트럼프 대통령도 이에 동의하고 외교 경로를 통해 협의해 나가자고 했다""고 발표한 바 있다.      양국이 4월 중순 한미정상회담을 여는 쪽으로 의견을 모은 건 먼저 최근 불거진 한·미 공조 균열 논란을 서둘러 봉합할 필요성이 대두했기 때문으로 보인다. 한미 관계를 둘러싸고 미 행정부 뿐 아니라 의회와 싱크탱크에서도 ""문 대통령이 북한의 비핵화보다는 남북관계를 우선시하는 것 아니냐""는 회의적 시각이 번지고 있기 때문이다. 워싱턴의 한 소식통은 ""두 나라가 북한의 완전한 비핵화에 같은 접근을 하고 있다는 점을 대내외에 과시하고, 나아가 한미동맹이 미국의 동아시아 안보의 '린치핀(linchpin·핵심축)임을 다시 트럼프 대통령에게 확인받는 게 한국으로선 최우선 과제가 될 것""이라고 전했다. 또한 북미 간 대화 분위기를 이어갈 수 있는 동력을 시급히 마련해야 한다는 판단도 크게 작용한 것으로 알려졌다. 내년 대선을 앞두고 미국이 올 하반기 부터 본격적인 선거전에 돌입해 북미 협상이 관심사에서 밀릴 가능성이 큰 만큼 대화 분위기를 이어가게 하기 위해선 조기에 한미 정상이 만나 북한이 협상 테이블로 나오게끔 할 돌파구를 마련해야 한다는 것이다.  실제 김정은 북한 국무위원장이 조만간 예상되는 블라디미르 푸틴 대통령과의 정상회담에서 '제재 완화'를 촉구하는 연합전선을 구축할 경우 북한의 비핵화 후속 협상 거부가 장기화될 수 있다. 김현종 국가안보실 2차장이 이번 주말 워싱턴 방문에 앞서 러시아를 비공개 방문한 것도 북·러 정상회담 움직임을 확인하고 러시아 측에 북한의 협상 복귀를 설득해달라고 요청했을 공산이 크다.  다만 지난 하노이 회담에서 드러났듯 트럼프 행정부는 일괄타결 방식의 비핵화, 즉 '빅딜'을 주장하며 북한이 요구하는 제재완화에 여전히 부정적이다. 미 의회에선 오히려 '제재 강화'를 촉구하는 목소리가 커지고 있다. 이런 상황 속에 이번 한미정상회담에서 어떤 합의점이 도출될지 주목된다. 워싱턴=김현기·정효식 특파원 luckyman@joongang.co.kr","대통령, 회담, 미, 트럼프, 정상, 북한, 한, 이번, 미국, 워싱턴",0,94
2019/03/29,중앙일보,정치,한미정상회담 4월 중순 개최될 듯,https://news.joins.com/article/olink/23018086,"문재인 대통령과 도널드 트럼프 미국 대통령 간 한미정상회담이 다음달 중순 미국에서 열릴 것으로 전해졌다. 청와대와 미 백악관은 조만간 이를 공식 발표할 예정이다. 회담 장소는 워싱턴이 될 공산이 큰 것으로 알려졌다. 고위 소식통은 28일 ""워싱턴을 29일(현지시간) 방문하는 강경화 외교장관과 마이크 폼페이오 미 국무장관 간에 이와 관련한 논의가 이뤄질 것""이라고 말했다.   또한 김현종 국가안보실 2차장도 30일 워싱턴을 찾아 찰스 쿠퍼먼 백악관 국가안보회의(NSC) 부보좌관 등 미 정부 관계자들과 한미정상회담 의제를 집중 논의할 방침이다. 소식통은 ""두 정상은 지난달 하노이 2차 북미정상회담 결렬 이후의 상황 전개에 대해 인식을 공유하고 새로운 정책 방향을 조율할 방침""이라고 전했다. 문재인 대통령과 트럼프 대통령 간 정상회담은 유엔총회나 주요 20개국 회의(G20) 등 다자회의에서의 만남을 포함하면 이번이 7번째가 된다. 그동안 외교가에선 하노이 회담 직후 추진되던 한미정상회담이 늦어지면서 그 시기에 대한 궁금증이 컸다. 하노이 회담 직후인 지난달 28일 청와대 김의겸 대변인은 ""문 대통령은 트럼프 대통령과 전화통화를 갖고 '가까운 시일 안에 직접 만나 보다 심도 있는 협의를 계속해 나가자'고 했고, 트럼프 대통령도 이에 동의하고 외교 경로를 통해 협의해 나가자고 했다""고 발표한 바 있다.      양국이 4월 중순 한미정상회담을 여는 쪽으로 의견을 모은 건 먼저 최근 불거진 한·미 공조 균열 논란을 서둘러 봉합할 필요성이 대두했기 때문으로 보인다. 한미 관계를 둘러싸고 미 행정부 뿐 아니라 의회와 싱크탱크에서도 ""문 대통령이 북한의 비핵화보다는 남북관계를 우선시하는 것 아니냐""는 회의적 시각이 번지고 있기 때문이다. 워싱턴의 한 소식통은 ""두 나라가 북한의 완전한 비핵화에 같은 접근을 하고 있다는 점을 대내외에 과시하고, 나아가 한미동맹이 미국의 동아시아 안보의 '린치핀(linchpin·핵심축)임을 다시 트럼프 대통령에게 확인받는 게 한국으로선 최우선 과제가 될 것""이라고 전했다. 또한 북미 간 대화 분위기를 이어갈 수 있는 동력을 시급히 마련해야 한다는 판단도 크게 작용한 것으로 알려졌다. 내년 대선을 앞두고 미국이 올 하반기 부터 본격적인 선거전에 돌입해 북미 협상이 관심사에서 밀릴 가능성이 큰 만큼 대화 분위기를 이어가게 하기 위해선 조기에 한미 정상이 만나 북한이 협상 테이블로 나오게끔 할 돌파구를 마련해야 한다는 것이다.  실제 김정은 북한 국무위원장이 조만간 예상되는 블라디미르 푸틴 대통령과의 정상회담에서 '제재 완화'를 촉구하는 연합전선을 구축할 경우 북한의 비핵화 후속 협상 거부가 장기화될 수 있다. 김현종 국가안보실 2차장이 이번 주말 워싱턴 방문에 앞서 러시아를 비공개 방문한 것도 북·러 정상회담 움직임을 확인하고 러시아 측에 북한의 협상 복귀를 설득해달라고 요청했을 공산이 크다.  다만 지난 하노이 회담에서 드러났듯 트럼프 행정부는 일괄타결 방식의 비핵화, 즉 '빅딜'을 주장하며 북한이 요구하는 제재완화에 여전히 부정적이다. 미 의회에선 오히려 '제재 강화'를 촉구하는 목소리가 커지고 있다. 이런 상황 속에 이번 한미정상회담에서 어떤 합의점이 도출될지 주목된다. 워싱턴=김현기·정효식 특파원 luckyman@joongang.co.kr","미, 회담, 대통령, 정상, 북한, 트럼프, 워싱턴, 한, 미국, 간",0,94
2019/03/01,중앙일보,정치,회담 4시간 만에 결렬 발표…65시간 기차타고 온 김정은 빈손,https://news.joins.com/article/olink/22991096,"김정은 북한 국무위원장의 직감은 틀렸다. 김 위원장은 28일 오전 8시55분(현지시간) 도널드 트럼프 미국 대통령과 단독 정상회담을 앞두고 메트로폴 호텔에서 만나 “나의 직감으로 보면 좋은 결과가 생길 거라고 믿는다”고 말했다. 트럼프 대통령의 말은 미묘했다. “속도는 중요하지 않다”며 “서두르지 않겠다”는 말을 세 번 반복했다. 하노이 정상회담의 기대치를 낮추는 제스처였다.   전날 만찬에서 “(이번 회담이) 1차 정상회담과 같거나 더 대단할 것”(트럼프), “모든 사람이 반기는 훌륭한 결과를 위해 최선을 다하겠다”(김정은)는 말의 성찬을 내놓은 것과는 톤이 달랐다.   이상기류는 사실 27일 오후부터 감지됐다. 미국의 비핵화 의지가 상당히 강경해 “모든 것이 합의될 때까지는 아무 것도 합의해줄 수 없다”는 게 미국 입장이라는 말이 돌았다. 28일 새벽 협상 과정에 정통한 소식통은 “김정은에게 달려 있다”며 “미국은 카드를 던졌고, 준비가 돼 있다. 김 위원장이 그 카드를 받을지 봐야 한다. 아직 모른다”고 전했다.   이상기류가 본격화한 건 단독회담 후다. 단독회담을 예정대로 약 30분 만인 9시36분에 끝낸 양 정상은 중앙정원을 산책한 뒤 9시45분 확대회담에 돌입했다. 확대회담은 배치부터 미묘했다. 참석자 수를 맞추는 것이 정상회담 관례지만 통역을 포함해 미국이 5명, 북한은 4명이 참석했다. 미국의 추가 참석자는 대북 강경파인 존 볼턴 백악관 국가안보보좌관이었다. 북한의 비핵화 실질 조치가 없다면 제재 완화도 없다는 ‘배드 캅(bad cop)’이 벤치가 아닌 본게임에 등장한 것이다.   확대회담을 기자들에게 공개한 자리에서 김 위원장에게 백악관 출입기자가 “비핵화를 할 준비가 돼 있느냐”고 묻자 김 위원장은 “만약 비핵화 의지가 없다면 내가 여기 왜 왔겠는가”라고 답했다. 평양 미국 연락사무소 설치에 대해 기자들이 김 위원장에게 질문하자 북측 실무진이 저지하려 했고, 그 순간 트럼프 대통령이 “흥미로운 아이디어”라고 말을 잘랐다. 이후 김 위원장은 “환영할 만한 일”이라고 말했고 트럼프 대통령도 “좋을 것”이라고 답했다.   문제는 그 다음이다. 확대회담이 비공개로 전환된 후 업무오찬이 예정된 11시55분에서 30분이 지났지만 오찬장은 텅 비어 있었다. 백악관 현장 기자들은 오찬장 테이블에 물은 채워져 있지만 참석자는 없는 모습을 사진으로 공개하며 “조짐이 이상하다”고 전했다.   약 10분 뒤인 12시35분, 백악관 세라 샌더스 대변인이 기자들을 찾아 “일정에 변화가 생겼다”고 전했다. 기자단은 대기하다 1시쯤 백악관의 안내로 회담장에서 철수해 대기 차량에 탑승했다.   백악관은 1시37분, 샌더스 대변인 명의로 “(양 정상이) 비핵화와 경제발전을 이끌 수 있는 다양한 방법을 논의했다”면서도 “이번엔 아무런 합의도 이뤄지지 않았으나 (북·미) 양측은 미래에 만날 것을 고대한다”고 밝혔다. 회담 결렬이 공식화됐다. 양 정상이 오전 8시55분에 만난 지 4시간40여 분 만이었다. 2시5분으로 예정됐던 ‘하노이 선언’ 서명식은 취소됐고, 4시 진행 예정이었던 기자회견은 2시간 앞당겨졌다.   기자회견도 지난해 싱가포르보다 짧고 분위기도 가라앉았다. 지난해 싱가포르 회견에선 북한 경제개발 가능성을 다룬 짤막한 영상을 먼저 트는 ‘깜짝 쇼’를 한 뒤 화려하게 등장했었다. 그러나 이날 트럼프 대통령은 폼페이오 장관이 함께 단상에 서서 결렬 쟁점을 설명했다.   기자회견 후 트럼프 대통령은 바로 노이바이 공항으로 직행, 전용기 에어포스원에 탑승, 베트남을 떠났다. 오후 5시25분쯤 “하노이의 환대에 감사한다”는 요지로 마지막 트윗을 남겼다. 65시간40분을 열차로 달려온 김 위원장과 대서양을 가로질러 지구 반 바퀴를 날라온 트럼프 대통령 모두 빈손으로 귀국하게 됐다.   하노이=전수진 기자 chun.sujin@joongang.co.kr","회담, 트럼프, 김, 위원장, 미국, 대통령, 정상, 백악관",0,94
2019/03/01,중앙일보,"정치,국제",트럼프 “속도 중요하지 않다” 섣불리 북에 양보 땐 여론 악화 우려,https://news.joins.com/article/olink/22991102,"도널드 트럼프 대통령은 28일 오전 김정은 북한 국무위원장과의 북·미 단독 정상회담에 들어가기에 앞서 모두 발언에서 “속도는 중요하지 않다”고 말했다. 그는 “서두르지 않을 것”이라고 거듭 말하면서 “올바른 합의를 이끌어내는 것이 더 중요하다”고 강조했다. 이때까지만 해도 신중하게 회담을 진행하겠다는 뜻으로 읽혔다. 그러나 이날 정상회담이 결국 합의문도 내지 못하고 끝나면서 트럼프 대통령의 발언은 일종의 복선이었다는 해석이 지배적이다.   트럼프 대통령은 회담이 결렬된 후 연 기자회견에서 “내가 원하면 100% 서명할 수 있었다. 합의문도 있었다”면서도 “그런데 준비가 안 됐다고 봤다. 서두르기보다는 올바른 결정을 내린 것이 맞는다고 생각한다”고 말했다. 결국 자신의 판단에 따라 협상을 중단했다는 얘기다. 신범철 아산정책연구원 안보통일센터장은 “트럼프 대통령은 최상의 결과를 가져오지 않는 한 북한과 합의를 볼 생각이 전혀 없다는 것을 분명히 밝혔다”고 분석했다.   트럼프 대통령이 북한의 비핵화를 놓고 장기전에 들어간 데는 미국 국내의 정치 상황도 영향을 미친 것으로 관측된다. 베트남 하노이에서 북·미 정상회담이 진행되는 동안 미국에선 그의 개인 변호사이자 해결사(fixer) 역할을 했던 마이클 코언이 의회 청문회에 출석했다. 코언은 청문회에서 트럼프 대통령을 “인종차별주의자이며 사기꾼, 협잡꾼”이라고 비난하면서 그에게 불리한 내용을 폭로했다.     이날 CNN을 비롯한 미국의 주류 언론은 물론 친트럼프 성향의 폭스뉴스까지 북·미 정상회담보다 코언 청문회에 더 주목했다.    트럼프 대통령이 북·미 정상회담 결렬을 설명하는 이날 기자회견장에서도 코언의 증언에 대한 질문이 나왔다. 트럼프 대통령은 “정상회담 중간에 그런 청문회를 한다는 것은 있을 수 없는 일이다. 옳은 일이 아니다”고 노골적으로 불만을 드러냈다.   이 때문에 트럼프 대통령은 국내에서 정치적 악재가 불거지는 상황에서 북한을 상대로 대북제재 완화라는 상응 조치를 내줬다간 더욱 여론의 압박을 받을 것을 우려했다는 분석이 나온다. 트럼프 대통령에겐 내년 재선 도전이 최대의 관심사다. 당초엔 북·미 합의문을 만들어내 자신의 최고 치적으로 내세우려고 했지만, 미국 국내 정치라는 변수를 만나자 회담 결렬이라는 충격적 카드를 내놓은 것 아니냐는 얘기다. 트럼프 대통령은 이날 기자회견에서 “현재 제재가 유지되고 있다. 제재가 하나도 해제되거나 완화된 게 없다”고 강조했다.   박원곤 한동대 지역학과 교수는 “트럼프 대통령으로서는 좋건 싫건 북한의 비핵화를 확실히 못 박을 수 있는 합의안을 들고 가야만 할 상황에 놓였던 셈”이라며 “트럼프 대통령은 그렇다고 판을 다 깰 생각은 없는 것처럼 보인다”고 말했다. 트럼프 대통령은 “이날 협상은 우호적으로 마무리됐다”며 “악수도 하고 마무리했다. 김정은, 북한과 계속 좋은 친구 관계를 유지할 것”이라고 말했다. 협상 재개 시점을 묻는 말에 “조만간 협상이 열릴 수도 있고 시간이 지나야 협상이 열릴 수도 있지만 조만간 이뤄지길 바란다”고 말했다. 세라 허커비 샌더스 백악관 대변인도 성명에서 “양측은 미래에 만날 것을 고대하고 있다”고 밝혔다.     그러나 ‘회담 재개 기대’ 발언은 현재로선 외교적 언사로 보인다. 트럼프 대통령은 속도는 중요하지 않다고 반복했는데 이는 향후 북·미 실무진이 비핵화 협상을 이어 나가면서 자신이 만족할 합의문을 가져올 때까지 기다리겠다는 버티기 전략이 된다. 비핵화 협상을 깨지도 않지만 그렇다고 먼저 움직이지도 않겠다는 태도로 풀이된다. 마이크 폼페이오 국무장관도 “김 위원장은 준비가 돼 있지 않았다. 시간이 오래 걸릴 것이라고 생각한다”고 북한을 압박해 트럼프 대통령을 거들었다.     이철재 기자 seajay@joongang.co.kr","트럼프, 대통령, 회담, 북한, 협상, 북, 미, 정상, 이날, 합의문",0,94
