date,press,category,headline,url,text,topics,labels,cnt
2019/03/25,한겨레,국제,뮬러 특검 “트럼프-러시아 공모 못 찾았다”…트럼프 “완전한 면죄 입증”,http://www.hani.co.kr/arti/international/international_general/887228.html,"2016년 미국 대선 때 도널드 트럼프 캠프와 러시아 사이의 공모 의혹을 수사해온 로버트 뮬러 특검팀이 “공모했다는 사실을 규명하지 못했다”고 24일(현지시각) 밝혔다. 특검팀의 또 다른 수사 대상인 트럼프 대통령의 사법방해 의혹에 대해서도 뮬러 특검은 결론을 유보했다. 22개월 만에 나온 이같은 결론에 트럼프 대통령은 “완전한 면죄부”라며 승리를 선언했고, 민주당은 ‘보고서 전면 공개’를 요구했다. 윌리엄 바 미 법무장관은 이날 상원과 하원 법사위원회에, 지난 22일 뮬러 특검으로부터 전달받은 수사보고서의 주요 결론을 요약해 제출했다. 바 장관은 전체 4쪽인 이 요약본에서 “특검팀의 수사는 트럼프 캠프 및 관련된 어떤 인사도 2016년 미국 대선에 영향을 미치려는 시도와 관련해, 러시아와 연계된 인사들로부터 트럼프 캠프 지원을 위한 여러 제안이 있었음에도 러시아와 공모하거나 협력했다는 걸 찾지 못했다”고 밝혔다. 뮬러 특검은 보고서에서 “수사는 트럼프 캠프 구성원들이 러시아 정부의 선거 개입 행위와 관련해 러시아 정부와 공모하거나 협력했다는 점을 규명하지 못했다”고 밝혔다고 바 장관은 부연했다.뮬러 특검은 트럼프 대통령이 러시아의 대선 개입 의혹 관련 초기 수사를 했던 제임스 코미 전 연방수사국장을 해임한 것과 관련한 사법방해 의혹에 대해서는 뚜렷한 결론을 내리지 않았다. 바 장관은 “특검은 이쪽이나 저쪽으로 결론을 내리지 않았다”고 밝혔다. 다만 뮬러 특검은 보고서에서 “이 보고서는 대통령이 범죄를 저질렀는지에 대해 결론을 내지 않았지만, 그렇다고 그가 무죄임을 밝히는 것도 아니다”라고 적시했다고 바 장관은 요약본을 통해 전했다.그러나 바 장관은 “이 보고서는 우리가 판단하기에 사법 방해적 행위를 구성하는 어떠한 행동도 찾지 못했다”며 “로드 로즌스타인 부장관과 나는 특검의 조사 과정에서 확보된 증거들은 대통령이 사법 방해를 저질렀다는 혐의를 확립하기에 불충분하다고 결론 내렸다”고 밝혔다.바 장관은 뮬러 특검팀의 전체 수사보고서를 일반에 공개하는 문제와 관련해, 다른 법과 규정들이 허락하는 한 최대한 공개하겠다고 밝혔다.이에 대해 트럼프 대통령은 플로리다에서 백악관으로 복귀하는 길에 기자들에게 “오랜 조사 끝에, 너무도 많은 이들이 심하게 상처받은 끝에, 그리고 많은 나쁜 일들이 일어난 반대편에 대해서는 들여다보지도 않은 후에, 러시아와 공모는 없었다고 발표됐다”며 “완전하고 전면적인 무죄 입증”이라고 말했다. 그는 이어 백악관 앞에서 기자들에게 “미국은 전세계에서 가장 위대한 곳이다”라고 짤막히 언급했다. 앞서 그는 트위터에 “공모는 없었다. 사법 방해도 없었다”고 적었다.민주당은 보고서 전체를 공개하라고 주장했다. 낸시 펠로시 하원의장과 척 슈머 상원 원내대표는 공동성명을 내어 “뮬러 특검 보고서에 사법 방해와 같은 심각한 사안에 대해 트럼프 대통령의 무죄를 입증하지 못했다는 것은 전체 보고서가 더이상 지체없이 공개돼야 할 시급성을 보여준다”고 밝혔다. 민주당은 특히 사법 방해 혐의에 대해 뮬러 특검이 결론을 내지 않았는데도 바 장관이 면죄부를 줬다고 공격했다.뮬러 특검의 보고서가 트럼프 대통령에게 치명적인 결과를 담고 있지 않은 것으로 밝혀짐에 따라, 펠로시 의장이 이미 “그럴 만한 가치가 없다”고 말한 트럼프 대통령 탄핵 추진은 동력이 더 약해질 것으로 보인다. 하지만 전체 보고서 공개 요구와 민주당이 장악한 하원에서의 청문회 등이 이어지면서 내년 11월 대선을 앞두고 정치적 공방이 지속될 것으로 보인다. 뮬러 특검과 무관하게 뉴욕 연방검찰 등이 벌이고 있는 트럼프 대통령 개인·가족·측근들의 비리 의혹 수사도 10여건 남아있다. 워싱턴/황준범 특파원 jaybee@hani.co.kr","특검, 트럼프, 보고서, 대통령, 장관, 수사, 뮬, 결론, 바, 러시아",22,10
2019/03/24,세계일보,"국제,정치",美 뮬러 특검 ‘러시아 스캔들’ 수사 결과 공개 임박,http://www.segye.com/content/html/2019/03/23/20190323621203.html,"美법무 “이르면 이번 주말 공개…최대한 투명하게 검토” / AP 등, 트럼프 대통령 기소엔 부정적 “뮬러 특검의 보고서를 검토하고 있으면 이르면 이번 주말에 주요 결론을 알릴 수 있기를 바란다. 최대한 투명하게 임하고 있다.”(윌리엄 바 美 법무장관) 2016년 미국 대선 당시 도널드 트럼프 대통령 캠프와 러시아간 내통 의혹에 대한 로버트 뮬러 특검의 수사가 22개월여만에 마무리됐다. 22일(현지시간) 그간의 수사결과를 담은 뮬러 특검의 보고서를 제출받은 윌리엄 바 법무장관은 이르면 이번 주말에 핵심 내용을 추려 의회에 보고하겠다고 밝혔다. 바 장관은 이날 관련 규정에 따라 뮬러 특검의 수사보고서를 제출받은 사실을 담은 서한을 연방 상·하원 법사위 지도부에 보냈다. 바 장관은 린지 그레이엄(공화)과 제럴드 내들러(민주) 상·하원 법사위원장 등 4명에게 보낸 서한에서 “뮬러 특검이 오늘 ‘비밀보고서’를 제출했다”면서 “보고서를 검토하고 있으며 이번 주말에 특검의 주요 결론을 알릴 수 있길 바란다”라고 밝혔다. 이어 “로드 로즌스타인 부장관과 뮬러 특검과 상의해 법에 따라 보고서의 어떤 내용을 의회와 대중에 공개할지 결정하겠다”면서 “최대한 투명하게 임하고 있으며 검토 상황을 계속 알리겠다”고 덧붙였다. 뮬러 특검 보고서 내용은 이르면 23일 의회를 통해 공개될 수 있다. 최대 관심사는 트럼프 캠프와 러시아의 공모 의혹의 사실 여부와 트럼프 대통령이 이에 대한 수사를 방해했는지 여부이다. 대통령 탄핵 사유인 ‘부정선거’와 ‘사법방해’ 의혹이 사실로 나타나면, 하원을 장악한 민주당을 주축으로 대통령 탄핵 움직임이 거세질 전망이다. 러시아 공모 의혹은 민주당의 힐러리 클린턴 캠프와 민주당 전국위원회(DNC) 이메일 수천건 해킹과 이에 대한 트럼프 캠프측 관여 여부, 트럼프 캠프와 러시아 인사들의 접촉, 대선 기간 트럼프 사업체의 모스크바 진출을 비롯한 부동산 거래 추진, 러시아에 대선 자료 전달, 러시아 정보기관의 소셜미디어를 통한 미 대선 개입 등이다. 수사 방해 의혹의 핵심은 트럼프 대통령의 제임스 코미 연방수사국(FBI) 국장 해임, 제프 세션스 법무장관에 대한 압력, 트럼프 측의 수사와 관련한 법무부 및 정보기관 접촉, 트럼프 측 인사들의 증인 회유 및 사면 암시·제안, 의회청문회 위증 등이다. 2017년 5월 17일 출범한 뮬러 특검은 22개월여 동안 수사하면서 트럼프 대통령의 측근인 폴 매너포트 전 선대본부장 등 34명과 기관 3곳을 기소했다. 매너포트 전 선대본부장과 릭 게이츠 전 부본부장, 조지 파파도풀로스 전 외교정책고문 등 대선 캠프 핵심인사들과 마이클 플린 전 백악관 국가안보보좌관, 트럼프 대통령의 오랜 친구이자 대선 기간 ‘비선 참모’로 활동한 정치 컨설턴트 로저 스톤, 트럼프 대통령의 전 개인 변호사 마이클 코언 등이 대통령의 측근 인사들로 수사를 받았다. 이중 매너포트와 게이츠, 파파도풀로스, 플린, 코언 등 6명은 형량을 감형받는 ‘플리바게닝’을 조건으로 범죄를 시인하고 유죄를 인정했다. 뮬러 특검은 민주당의 클린턴 대선후보 캠프와 민주당 전국위원회(DNC)의 이메일 해킹·폭로에 관여한 것으로 의심되는 러시아군 정보기관인 정찰총국(GRU) 소속 정보요원 12명과 ‘댓글 부대’ 역할을 한 러시아인 13명과 러시아 기관 3곳을 수사해 기소했다. 백악관은 의회에 제출될 특검보고서 내용에 촉각을 곤두세우고 있다. 세라 샌더스 백악관 대변인은 “우리는 절차가 진행되기를 기대한다”며 “백악관은 아직 특검 보고서를 제출받지도 브리핑을 받지도 않았다”고 말했다. 미 언론은 이번 특검 보고서 제출은 트럼프 캠프와 러시아 간 범죄 모의 혹은 트럼프 대통령의 사법방해 의혹에 대한 어떤 공개적인 기소도 없이 수사가 끝났다는 것을 의미한다고 평가했다. 한 법무부 관리는 이날 뮬러 특검이 이번 수사에서 어떤 추가 기소도 권고하지 않을 것이라고 확인했다고 AP통신은 전했다. AP통신은 특히 법무부가 현직 대통령은 기소되지 않는다는 점을 강조해온 것에 비춰볼 때 뮬러 특검이 트럼프 대통령의 범죄 혐의를 찾아낸 경우에도 그가 어떤 조치를 취할지는 불투명하다고 설명했다. 바 장관이 의회에 보낸 서한 말미에 “최대한 투명하게 임하겠다”고 밝힌 것도 미 언론의 이런 관측을 의식한 것이라는 평가다. 워싱턴=정재영 특파원 sisleyj@segye.com[ⓒ 세계일보 & Segye.com, 무단전재 및 재배포 금지]","트럼프, 특검, 대통령, 수사, 보고서, 러시아, 캠프, 장관, 대선, 뮬",22,10
2019/03/24,한겨레,"국제,정치",미 정국 흔들 태풍의 눈 ‘뮬러 보고서’ 공개 임박,http://www.hani.co.kr/arti/international/america/887154.html,"미국 정국을 뒤흔들 ‘태풍의 눈’으로 여겨져 온 로버트 뮬러 특검의 최종 수사 보고서의 ‘핵심 내용’이 이르면 24일 의회에 공개된다. 보고서의 내용은 물론 공개 범위를 둘러싸고 미 의회 내에서 대 격돌이 이어질 전망이다.23일등 주요 언론 보도를 보면, 윌리엄 바 법무부 장관은 22일 뮬러 특검으로부터 2017년 5월 이후 2년 가까이 진행해 온 수사 결과에 대한 최종 보고서를 제출 받았다. 바 장관은 로드 로젠스타인 부장관 등 참모들과 보고서를 검토한 뒤, 이르면 24일 보고서의 ‘핵심 내용’을 의회에 보고할 예정이다. 은 바 법무장관이보고서의 공개 범위를 정하기 위해 뮬러 특검의 조언도 들었다고 전했다.뮬러 특검은 그동안 민주당 캠프를 해킹하는 등 미 대선에 개입한 것으로 확인된 러시아와 트럼프 캠프가 공모했는지, 트럼프 대통령이 이에 대한 미 사법당국의 수사를 방해했는지 등 두 가지 핵심 쟁점에 대한 수사를 진행해 왔다. 뮬러 특검은 그동안 폴 매너포트 전 선거대책위원회 본부장 등 트럼프 대통령의 측근 6명 등 34명과 3개 기업을 기소했다. 그러나 기소 내용은 대부분 핵심 쟁점과 관계없는 ‘수사 기관에 대한 허위진술’과 ‘사기’ 혐의에 대한 것이었다.(AP) 통신 등은 뮬러 특검이 보고서 제출 이후 법무부에 “추가 기소는 없을 것”이라는 입장을 밝혔다고 전했다. 뮬러 특검이 트럼프 대통령과 러시아의 공모 또는 트럼프 대통령의 사법 방해 의혹을 명확히 입증하는데 실패했음을 암시하는 대목이다. 이를 인식한 듯 트럼프 대통령은 20일 백악관에서 기자들에게 보고서에 대해 “신경 안 쓴다. 사람들이 보게 하라”고 말했다. 트럼프 대통령은 이전엔 뮬러 특검의 수사에 대해 “역대 최악의 마녀사냥” 등의 거친 표현을 써가며 강한 불만을 터뜨려 왔다. 는 트럼프 대통령이 2년 동안 1100회 이상 수사를 비판했다고 꼬집었다.민주당은 보고서를 전면 공개해야 한다고 주장하며 트럼프 대통령에 대한 공세를 강화할 것으로 보인다. 낸시 펠로시 하원의장은 22일 “미 국민들은 진실을 알 권리가 있다”며 보고서의 전면 공개를 주장했다. 미국 시민단체 ‘전자프라이버시정보센터(EPIC)도 정보공개청구법(FOIA)에 따라 워싱턴 연방지방법원에 법무부를 상대로 특검 보고서와 관련 자료의 공개를 요구하는 소송을 제기한 것으로 전해졌다.보고서의 공개 범위를 결정할 권한은 바 장관에게 있다. 바 장관은 “법률이 정해진 범위 안에서 공개를 하겠다”는 입장을 밝혀왔다.길윤형 기자 charisma@hani.co.kr","보고서, 특검, 공개, 트럼프, 대통령, 뮬, 수사, 장관, 바, 핵심",22,10
2019/03/24,세계일보,"국제,정치",‘러 스캔들’ 실체 규명 실패?… 트럼프 기소 면할 듯,http://www.segye.com/content/html/2019/03/24/20190324598128.html,"뮬러 특검 수사 22개월 만에 종료… ‘수사보고서’ 공개 범위 촉각 / 바 법무장관 주요내용 의회 보고 / 조만간 구체적 수사결과 나올 듯 뮬러 / 특검, 추가 기소는 권고 안해 / 법무부, 혐의 있어도 조치는 불투명 / 민주, 전체 보고서 모두 공개 압박 / 바 법무 공개 수위 따라 새 불씨로2016년 미국 대선 당시 도널드 트럼프 캠프 측과 러시아의 내통 의혹을 수사해온 로버트 뮬러 특검이 22일(현지시간) 22개월여 동안의 수사를 종결하고, 수사보고서를 윌리엄 바 법무장관에게 넘겼다. 바 장관이 이르면 24일 주요내용을 의회에 보고하면 구체적인 수사결과가 공개될 전망이다. 미국 언론은 트럼프 대통령이 기소되지 않을 것으로 예상하고 있다.바 장관은 이날 관련 규정에 따라 뮬러 특검의 수사보고서를 제출받은 사실을 알리는 서한을 연방 상·하원 법사위 지도부에 보냈다. 그는 린지 그레이엄(공화)과 제럴드 내들러(민주) 상·하원 법사위원장 등 4명에게 보낸 서한에서 “뮬러 특검이 오늘 ‘비밀보고서’를 제출했다”고 밝혔다. 그러면서 “보고서를 검토하고 있으며 이번 주말에 특검의 주요 결론을 알릴 수 있길 바란다”고 말했다. 이어 “로드 로즌스타인 부장관과 뮬러 특검과 상의해 법에 따라 보고서의 어떤 내용을 의회와 대중에 공개할지 결정하겠다”면서 “최대한 투명하게 임하고 있으며 검토 상황을 계속 알리겠다”고 설명했다.수사보고서의 최대 관심사는 트럼프 캠프와 러시아의 공모 사실과 트럼프 대통령의 수사 방해 여부이다. 대통령 탄핵 사유인 ‘부정선거’와 ‘사법방해’ 의혹이 사실로 드러나면, 하원을 장악한 민주당을 주축으로 대통령 탄핵 움직임이 거세질 수 있다.하지만 뉴욕타임스(NYT)는 뮬러 특검이 어떤 추가 기소도 권고하지 않았다고 전했다. AP통신도 이번 보고서 제출은 트럼프 캠프와 러시아 간 범죄 공모 혹은 트럼프 대통령의 사법방해 의혹에 대한 어떤 공개적인 기소도 없이 수사가 끝났다는 것을 의미한다고 설명했다.러시아 공모 의혹의 핵심은 민주당의 힐러리 클린턴 캠프와 민주당 전국위원회(DNC) 이메일 수천건 해킹과 이에 대한 트럼프 캠프측 관여, 트럼프 캠프와 러시아 인사들의 접촉, 러시아 정보기관의 소셜미디어를 통한 미 대선 개입 여부 등이다. 수사 방해 의혹은 트럼프 대통령의 제임스 코미 연방수사국(FBI) 국장 해임, 제프 세션스 법무장관에 대한 압력 등이 최대 쟁점이다.2017년 5월 17일 출범한 뮬러 특검은 22개월여 동안 수사하면서 트럼프 대통령의 측근인 폴 매너포트 전 선대본부장 등 34명과 기관 3곳을 기소했다.AP통신은 법무부가 현직 대통령은 기소되지 않는다는 점을 강조해온 것에 비춰볼 때 뮬러 특검이 트럼프 대통령의 범죄 혐의를 찾아낸 경우에도 어떤 조치가 취해질지 불투명하다고 지적했다.이에 민주당은 전체 보고서뿐 아니라 수사 결론 도출에 동원된 관련 증거자료까지 모두 공개하라고 압박하고 있다. 바 장관이 수사보고서를 얼마나 공개하느냐에 따라 민주당의 대응 수위가 결정될 것으로 보인다. 보고서 공개 범위가 정치권 대치의 불씨가 될 수 있는 셈이다. 워싱턴=정재영 특파원 sisleyj@segye.com[ⓒ 세계일보 & Segye.com, 무단전재 및 재배포 금지]","수사, 보고서, 트럼프, 특검, 공개, 대통령, 뮬, 장관, 바, 캠프",22,10
2019/03/25,동아일보,국제,‘러시아 스캔들’ 특검 종료… 보고서 공개 수위 주목,http://news.donga.com/3/all/20190325/94711864/1,"도널드 트럼프 미국 대통령의 ‘러시아 스캔들’을 조사한 로버트 뮬러 특별검사팀이 22일 수사를 종결했다. 특검이 보고서 공개 권한을 가진 윌리엄 바 법무장관에게 이를 제출했다고 뉴욕타임스(NYT) 등 미 언론이 23일 보도했다. 러시아 스캔들은 2016년 미 대선에서 러시아가 개입해 트럼프 당선을 배후조종했다는 의혹을 뜻한다.이 보고서에 어떤 내용이 담겼는지, 바 장관이 보고서를 공개할 것인지, 한다면 언제 어떤 방식으로 할지는 알려지지 않았다. 미 정보기관은 2016년 대선에 러시아가 개입했다는 결론을 내렸지만 트럼프 캠프 측과 러시아 간 공모가 있었는지, 또 대통령 개인이 사법방해를 했는지는 구체적으로 밝혀진 바가 없다. 특검이 이 핵심 의혹을 명쾌히 밝혀냈는지도 불투명하다. 법무부 내에서도 이 보고서를 본 사람은 극소수이며 백악관도 내용을 모르는 것으로 알려졌다.당초 미 언론은 바 장관이 23일 의회에 보고서를 전달하는 식으로 공개할 것이라고 예상했다. 하지만 이날 그는 보고서를 공개하지 않았고 두툼한 가방을 든 채 퇴근하는 모습만 목격됐다. 내용 및 공개 방식에 따라 트럼프 대통령이 취임 후 줄곧 자신을 괴롭힌 멍에를 벗어던질지, 더 깊은 위기에 빠질지 기로에 서 있는 셈이다.다만 뮬러 특검이 보고서를 제출하면서 “추가 기소를 권고하지 않는다”고 밝혀 대통령의 기소 가능성은 낮다는 분석이 많다. 공개 여부를 결정할 바 장관 역시 지난달 트럼프 대통령에 의해 임명됐다는 점을 감안할 때 그가 민주당이 주장하는 것처럼 완전한 내용을 공개할 가능성은 크지 않다고 미 언론은 전했다. 반면 야당 민주당은 “단순히 의회에 제출하는 수준이 아니라 보고서의 모든 내용을 국민에게 완전히 공개해야 한다”고 압박하고 있다.만약 트럼프 대통령이 러시아 스캔들 후폭풍에서 벗어나면 야당을 향한 역공에 나설 가능성도 크다. 그는 트위터에 “특검 조사는 마녀사냥”이란 비난만 무려 77회 올렸다. 22일에도 공석이던 미 중앙은행 연방준비제도(Fed·연준) 이사로 보수성향 헤리티지재단 출신의 스티븐 무어를 지명했다. 무어는 트럼프 대선 캠프에서 일했을 뿐 아니라 제롬 파월 현 연준 의장을 신랄하게 비판하며 그의 해고를 주장한 인물. 노골적 친(親)트럼프 인사를 상원 인준이 필요한 연준 이사로 지명한 것은 대통령이 자신에게 고분고분하지 않은 파월 의장을 견제하려는 것 아니냐는 지적이 나온다. 정미경 기자 mickey@donga.comCopyright by dongA.com All rights reserved.","트럼프, 보고서, 공개, 특검, 장관, 대통령, 러시아, 미, 바",22,10
2019/03/21,한겨레,국제,"트럼프, 특검 보고서에 자신있나…“공개하자” 큰소리",http://www.hani.co.kr/arti/international/international_general/886838.html,"도널드 트럼프 미국 대통령이 2016년 대선 때 러시아와 트럼프 캠프의 내통 의혹에 관한 로버트 뮬러 특별검사의 수사보고서를 “일반에 공개하자”고 말했다. 그러면서도 뮬러 특검을 ‘선출되지 않은 자’라고 깎아내렸다. 뮬러 특검은 2년 가까이 진행한 수사를 마치고 조만간 윌리엄 바 법무장관에게 보고서를 제출할 것이라는 관측이 나오고 있다.트럼프 대통령은 20일 백악관에서 기자들이 ‘미국 대중이 뮬러 보고서를 볼 권리를 갖고 있느냐’고 묻자 “신경 안 쓴다”며 “보고서 나오게 하라. 사람들이 보게 하라”고 말했다. 이어 “(공개 여부는) 법무장관에 달렸다. 그는 매우 존경받는 사람”이라고 말했다. 그는 “(러시아와의) 공모는 없다”는 말도 되풀이했다. 뮬러 특검은 2017년 5월 임명돼 ‘러시아 스캔들’을 수사해왔으며, 최근 수사팀 인력이 팀을 떠나는 등 수사 종료 움직임이 감지되고 있다.러시아 특검 수사를 마녀사냥이라고 비난해온 트럼프 대통령은 동시에 뮬러 특검을 강하게 비난했다. 그는 뮬러 특검을 자신이 해임한 제임스 코미 전 연방수사국장의 “가장 가까운 친구”라며, 이해상충 문제가 있다고 주장했다. 또 “나는 선거에서 미국 역사상 가장 큰 승리를 거뒀다. (그런데) 한 표도 받지 않은 사람이 보고서를 쓴다? 웃기는 일이라고 생각한다”고 말했다.이런 가운데 백악관에서는 특검 보고서에 트럼프-러시아 공모에 관한 ‘스모킹 건’(결정적 단서)이 담기지 않을 것이라는 낙관론이 커지고 있으며, 트럼프 대통령은 이를 2020년 재선을 위한 정치적 기회로 삼으려 한다고 (AP) 통신이 보도했다. 트럼프 대통령은 측근들에게 “보고서에 놀라운 내용이 없으면 트위터와 인터뷰를 통해 결과물을 흡족해하고, 수사 비용에 불만을 표하며, 수사 전체를 내 의제들을 방해하려는 시도로 묘사할 것”이라고 말했다고 이 매체는 전했다. 반면 민주당은 의회에서 트럼프 대통령의 과거 돈세탁 비리 등 다른 의혹들에 관해 조사를 강화할 채비를 하고 있다고 이 통신은 전했다. 워싱턴/황준범 특파원 jaybee@hani.co.kr","트럼프, 수사, 뮬, 보고서, 특검, 대통령, 러시아, 미국",22,10
2019/03/17,세계일보,정치,반기문 “국가에 도움 될 기회 줘 기뻐”,http://www.segye.com/content/html/2019/03/17/20190317531012.html,"미세먼지 문제 해결을 위한 / 범사회적 기구 위원장 수락반기문 전 유엔 사무총장이 ‘미세먼지 해결을 위한 범사회적 기구’ 위원장직을 수락했다고 청와대가 17일 전했다.한정우 청와대 부대변인은 이날 서면브리핑에서 노영민 청와대 비서실장이 전날 반 전 총장을 서울 모처에서 만나 위원장직을 맡아 달라고 공식 요청했다고 밝혔다.반 전 총장은 이 자리에서 “미세먼지 문제, 기후변화 문제를 해결하겠다는 대통령의 확고한 의지를 확인했다”며 “기후변화 등 국제 환경문제를 오랫동안 다뤄온 경험을 바탕으로 국가에 도움이 될 기회를 주신 것을 기쁘게 생각한다”고 말했다. 이어 “미세먼지에 관한 국민적 관심이 매우 높으나, 단기간에 해결하긴 어려운 과제여서 본인이 국민의 기대에 못 미칠까 부담과 걱정이 있다”며 “미세먼지 문제는 정파나 이념의 문제가 아니기 때문에 범국가 기구는 모든 정당, 산업계, 시민사회 등까지 폭넓게 포괄해야 한다”고 강조했다.청와대는 “반 전 총장은 문 대통령이 전폭적으로 범국가기구를 지원해 줄 것을 요청했다”고 설명했다.반 전 총장과 노 비서실장은 기구의 성격과 활동에 대해 대략적인 의견을 나눈 한편 구체적인 조직구성, 운영, 출범시기 등에 대해서는 실무협의를 통해 논의하기로 했다.바른미래당 손학규 대표가 앞서 미세먼지 해결을 위한 범사회적 기구를 구성하고 반 전 총장에게 위원장을 맡기자고 제안하자 문 대통령은 참모진에게 이를 적극적으로 수용하라고 지시했다. 박현준 기자 hjunpark@segye.com[ⓒ 세계일보 & Segye.com, 무단전재 및 재배포 금지]","해결, 기구, 총장, 위원장, 청와대, 문, “미세먼지, 대통령",21,5
