date,press,category,headline,url,text,topics,labels,cnt
2019/03/10,한겨레,정치,"박 전 대통령 탄핵 2년…정치권, 한국당 ‘탄핵 불복’ 목소리 우려",http://www.hani.co.kr/arti/politics/assembly/885263.html,"헌법재판소가 “피청구인 대통령 박근혜를 파면한다”고 선고한 지 2년을 맞은 10일, 정치권은 최근 전당대회 국면에서 불거진 자유한국당 내부의 ‘탄핵 불복’ 목소리에 대해 우려를 나타냈다.홍익표 더불어민주당 수석대변인은 이날 오전 서면 브리핑을 통해 “국정농단 사건 재판이 여전히 진행 중이나 박 전 대통령은 재판을 전면 보이콧 하고 있다”며 “자유한국당은 최근 전당대회를 거치며 탄핵을 부정하더니 급기야 형이 확정되지도 않은 박 전 대통령에 대해 사면을 운운하고 있다”고 비판했다. 이어 “일말의 책임감도, 촛불혁명 주역인 국민에 대한 존중도 찾아볼 수 없는 행태”라며 “제1야당의 품격은 찾아볼 수 없고, 오로지 극우 지지층의 결집만을 노리는 근시안적 퇴행의 길을 가는 꼴”이라고 지적했다. 신임 황교안 자유한국당 대표는 지난달 당대표 선거 후보자 토론회에서 “박 전 대통령 탄핵이 절차적으로 문제가 있다고 타당하지도 않다”고 말해 논란을 일으켰다. 이어 지난 6일 법원이 이명박 전 대통령에 대한 보석을 허가한 뒤, 박 전 대통령에 대한 사면설이 표면화됐다. 황 대표는 “(박 전 대통령이) 구속돼 재판이 계속되고 있는 문제에 대해 국민들의 여러 의견들이 감안된 조치가 있으면 좋겠다”고 사면에 대한 검토가 필요하다는 입장을 시사했다. 나경원 자유한국당 원내대표도 “정치적으로 사면 문제를 논의해야 할 때가 되지 않았나 생각한다”고 말했다.민주평화당 박주현 수석대변인도 전날 논평을 내어 자유한국당의 지지층을 겨냥한 ‘정치적 발언’을 비판했다. 그는 “탄핵에 책임 있는 세력이 다시 퇴행적인 행태로 국민을 현혹하고 있다”며 “정부·여당에 대한 실망의 반사적 이익을 얻는 잘못된 선거제도가 바뀌어야 탄핵과 촛불 혁명의 의미를 살릴 수 있다”고 강조했다. 10일 추가 논평을 통해선 “탄핵 주역이었던 세력이 여전히 개혁의 발목을 잡고 있고, 정부는 개혁과 민생문제해결에 성과를 보여주지 못하고 있다”며 “여야4당은 선거제개혁과 민생입법을 패스트트랙에 올려야 하고, 자유한국당은 자숙하는 심정으로 시대를 역행하는 비정상적인 언행을 당장 멈추어야 한다”고 꼬집었다. 정의당 정호진 대변인은 “자유한국당 황 대표와 나 원내대표의 입에서 거론된 박근혜 사면은 최고 헌법기관의 판결과 촛불 혁명에 대한 불복이자 거부”라며 “법적 판결이 진행 중임을 모르지 않을 터인데 사면 운운하는 것은 헌법 질서와 국민은 아랑곳하지 않고 ‘친박 제일주의’를 드러낸 것으로 사실상 '도로 친박당 선언”이라고 날을 세웠다.바른미래당 김관영 원내대표는 10일 오전 페이스북 메시지를 통해 “당시 국회 탄핵소추위원으로서 20여 회의 헌법재판소로의 재판 출석 후, ‘대통령 박근혜를 탄핵한다’는 선고를 들으면서 눈시울을 붉혔던 때가 생각난다”며 “국민 주권주의, 민주공화국, 자유시장경제라는 헌법 가치가 제대로 구현되고 있는지 되돌아본다. 아직 우리에겐 많은 과제가 있다”고 소회를 밝혔다. 이어 “민심이 제대로 반영되는 선거제도개혁과 제왕적 대통령의 권력을 분산하는 개헌은 우리가 꼭 이루어야 할 과제”라며 “대한민국의 주권은 국민에게 있다”고 강조했다. 바른미래당 이종철 대변인은 정부와 여당을 향한 쓴소리를 내놨다. 그는 “탄핵 2주년에 촛불 정신과 탄핵 정신은 과연 올바로 구현되고 있는지 심각한 회의를 던지지 않을 수 없다”며 “하루하루 생업에 전념하기에도 고단한 국민을 고작 2년 만에 다시 성난 호랑이가 되게 하고 있다”고 지적했다. 자유한국당은 뒤늦게 논평을 내어 “박 전 대통령의 탄핵은 민주주의 아픔이자 상처, 그리고 교훈”이라며 “대통령과 민주당은 이제 그만 탄핵 열차라는 과거에서 벗어나 국민과 함께 미래를 향해 걸어가길 바란다”고 밝혔다. 김현아 원내대변인은 “(정부는) 틈만 나면 2년 전 촛불과 광장의 민심을 들먹이며 자신들의 정책실패, 독선정치를 숨기고 있다”며 “지금이라도 대통령과 민주당은 역사의 교훈을 잊지 말기 바란다”고 입장을 냈다.김미나 기자 mina@hani.co.kr","대통령, 한국, 사면, 박근혜, 원내대표, 논평, 당, 탄핵, 국민, 자유",9,5
2019/03/10,국민일보,정치,"한국당 “文, 탄핵 정략적으로 이용말라”…민주당 “박근혜 사면론 충격” 비판",http://news.kmib.co.kr/article/view.asp?arcid=0013130490&code=61111111&cp=kd,"더불어민주당이 박근혜 전 대통령 탄핵 2주년을 맞아 자유한국당의 ‘박근혜 사면론’ 을 비판한 가운데 한국당은 정부·여당이 탄핵을 정략적으로만 활용하고 있다는 취지의 입장을 내놓았다. 한국당은 지난해 탄핵 1주년 당시에도 “대한민국이 탄핵 전보다 무엇이 더 나아졌는지 의문”이라며 정부·여당을 비판했다.김현아 한국당 원내대변인은 10일 논평을 통해 “박근혜 전 대통령의 탄핵을 여전히 국민의 분노와 상처를 자극하는 대상으로만 활용하고 자신들의 과오를 되돌아보는 거울로는 사용하고 있지 못하다”고 비판했다.김 대변인은 “틈만 나면 2년 전 촛불과 광장의 민심을 들먹이며 자신들의 정책실패, 독선 정치를 숨기고 있다”고 지적했다.그러면서 “대통령과 민주당은 국회를 무시하고 사법부와 언론을 길들이기에 혈안이 되어있을 뿐만 아니라 소득주도성장이라는 정책실패의 부작용이 쏟아지는 데도 국민의 정책수정 요구를 외면하는 독선만 보이고 있다”고 덧붙였다.그는 “2년 전 촛불을 들었던 국민들, 그리고 촛불을 들지는 않았지만 나라를 걱정했던 국민들은 탄핵의 아픔을 가슴에 새기고 일상으로 돌아갔다”며 “대통령과 민주당도 이제 그만 탄핵 열차라는 과거에서 벗어나 국민과 함께 미래를 향해 걸어가길 바란다”고 촉구했다.더불어민주당은 한국당발 ‘박근혜 사면론’을 비판했다. 권미혁 원내대변인은 서면 브리핑을 통해 “제1야당에서 나오는 탄핵 부정과 사면 등의 발언은 미래를 향해 나아가야 할 시점에 많은 충격과 우려를 낳고 있다”며 지나간 불행의 역사를 반복하기보다는, 새로운 대한민국을 만들라는 것이 국민의 명령이자 시대적 요구“라고 지적했다.정의당도 정호진 대변인 명의 논평에서 “한국당 황교안 대표와 나경원 원내대표 입에서 거론된 박근혜 사면은 촛불혁명에 대한 불복이자 거부이자 '도로 친박당 선언'”이라며 “국민을 두려워한다면 한국당 지도부는 국정농단 부역과 방조에 대한 책임을 통감해야지 친박 세력 모으기에 '올인'할 때가 아니다”고 목소리를 보탰다.바른미래당은 민주당과 한국당을 모두 걸고넘어졌다. 이종철 대변인은 “한쪽에서는 탄핵 부정 세력이 활개를 치고, 한쪽에서는 슈퍼 ‘내로남불’이 활개를 친다”며 “탄핵 2주년에 촛불 정신과 탄핵 정신이 과연 올바로 구현되고 있는지 심각한 회의를 던지지 않을 수 없다”고 목소리를 높혔다.심우삼 기자sam@kmib.co.kr","탄핵, 당, 한국, 국민, 박근혜, 대변인, 대통령, 사면, 촛불, 주년",9,5
2019/03/09,동아일보,정치,"박근혜 탄핵 2년…與 “사면 거론, 국민 우롱” 한국당 ‘침묵’",http://news.donga.com/3/all/20190309/94461151/2,"박근혜 전 대통령 탄핵 2년을 하루 앞둔 9일 여당인 더불어민주당과 바른미래당·민주평화당·정의당 등 야 3당은 각기 다른 논평을 내놨다. 다만 한국당은 현재까지 별다른 입장을 내고 있지 않다.더불어민주당은 이날 서재헌 상근부대변인 이름으로 논평을 내 “자유한국당의 황교안 당대표와 나경원 원내대표가 최근 회의 및 언론을 통해 국민의 삶 개선을 위한 민생법안 및 정책제안은 뒤로한 채, 지속적으로 박근혜 전 대통령의 사면 및 석방만을 요구하면서 국민이 그토록 원하는 대한민국의 미래를 위한 합리적 보수정당의 길을 스스로 배척하고 있다”고 지적했다.이어 “황 대표는 전당대회 과정에서 박근혜 전 대통령을 배신한 배박이라는 논란을 의식하여, 나 대표는 친박계의 지지를 등에 업고 당선된 영향으로 국민의 뜻은 안중에도 없고, 오직 친박의 아바타 역할만 수행하여 제1야당을 우경화의 길도 모자라 퇴행의 길로 몰아가고 있다”고 비판했다. 그러면서 “각각 검사 및 판사 출신으로 누구보다 헌법을 잘 이해하고 있는 두 대표가 국정농단 관련 사건과 국정원 특별활동비 상납 사건 등 재판이 진행되어 형 선고도 받지 않은 박 전 대통령에 대해 ‘형이 확정된 경우에만 가능한 사면’을 거론하고 있다는 것은 자기부정일 뿐만 아니라 촛불혁명의 주역인 대한민국 국민을 우롱하는 처사임이 분명하다”고 꼬집었다.아울러 “황 대표와 나 원내대표가 국민의 지지를 얻기 위한 행보가 아닌 박근혜 지지층의 결집만을 위한 역사적 퇴행의 길을 가는 것에 대해 보수언론조차 우려하고 있다”며 “자유한국당이 국민이 진정으로 원하는 품격 있는 건전한 보수 재건의 길을 가기를 다시 한 번 촉구한다”고 밝혔다.바른미래당은 박근혜 전 대통령 탄핵을 인용하며 현 정부를 비판했다. 바른미래당 이종철 대변인은 논평을 통해 “‘대통령 탄핵 가결’이라는 헌정 사상 초유의 사태를 겪은 지 2년이 되었다”면서 “정치적 폐습은 과연 청산되었는가. 폐습은 그대로인데 사람만 바뀐 것인가. 아니면 그 진통에도 불구하고 도리어 폐습이 더 깊어진 건가. 지금 국민들은 혼란스럽기만 하다”고 지적했다.그러면서 “한쪽에서는 탄핵 부정 세력이 활개를 치고, 한쪽에서는 슈퍼 ‘내로남불’이 활개를 친다. 작든 크든 잘못을 해서는 안 되는 것이며, 잘못을 했으면 누구를 막론하고 벌을 받아야 한다. 그것이 위정자를 향한 ‘촛불 정신’이고 ‘탄핵 정신’”이라며 “탄핵 2주년에 촛불 정신과 탄핵 정신은 과연 올바로 구현이 되고 있는지 심각한 회의를 던지지 않을 수 없다”고 밝혔다. 민주평화당 박주현 수석대변인은 구두 논평을 통해 “탄핵 2주년은 한겨울 내내 한마음으로 공평과 정의의 대한민국을 염원했던 촛불 민심을 다시 되새기는 계기가 되어야 한다”면서 “역사를 거스르는 비정상적인 정치에 대해서도 탄핵이 필요하다는 것이 탄핵을 이루어냈던 촛불 민심”이라고 지적했다.정의당 정호진 대변인은 브리핑을 통해 “박근혜 전 대통령의 국가적 범죄행위에 대한 법의 심판이 진행 중이다. 그리고 켜켜이 쌓아 놓은 적폐 청산도 진행 중이다. 여전히 촛불이 꺼지지 않고 있는 이유”라며 “그런데 탄핵 선고 고작 2년 밖에 지나지 않은 지금, 국정 농단을 방조한 자유한국당에서 박근혜 탄핵 부정과 심지어 일고의 가치도 없는 박근혜 사면까지 거론하고 있다”고 꼬집었다.자유한국당은 9일 오후 5시 현재까지 박 전 대통령 탄핵 2년과 관련해 어떠한 입장도 내지 않고 있다.정봉오 동아닷컴 기자 bong087@donga.comCopyright by dongA.com All rights reserved.","탄핵, 당, 국민, 박근혜, 대통령, 대표, 길, 촛불, 한국, 논평",9,5
2019/03/09,중앙일보,정치,‘朴사면론’ 끄집어낸 한국당…여야 “도로 친박당” “역사적 퇴행”,https://news.joins.com/article/olink/22998246,"이명박 전 대통령의 조건부 보석을 계기로 박근혜 전 대통령에 대한 사면론이 자유한국당에서 공론화될 조짐을 보이는 가운데, 더불어민주당은 “국민이 원하는 길이 아닌 역사적 퇴행의 길을 가고 있는 자유한국당이 우려스럽다”고 비난했다.   박 전 대통령 탄핵 2주년을 하루 앞둔 9일 여야 4당은 초점을 각기 달리한 논평을 내놨다. 민주당은 ‘박 전 대통령 사면론’을 강하게 비난했고, 바른미래당은 민주당과 한국당을 같이 비판하며 촛불정신이 제대로 구현되지 않고 있다고 지적했다. 민주평화당과 정의당은 한국당을 향해 ‘탄핵세력의 선거제 개혁 방해’, ‘도로 친박당의 모습’이라고 각각 주장했다.   민주당 서재현 부대변인은 이날 논평을 통해 “한국당의 황교안 대표와 나경원 원내대표는 지속적으로 박 전 대통령의 사면 및 석방만을 요구하며, 국민이 그토록 원하는 대한민국의 미래를 위한 합리적 보수정당의 길을 스스로 배척하고 있다”고 말했다. 이어 황 대표와 나 원내대표에 대해 “각각 검사 및 판사 출신으로 누구보다 헌법을 잘 이해하고 있는 두 지도부가 형 선고도 받지 않은 박 전 대통령에 대해 ‘형이 확정된 경우’에만 가능한 사면을 거론하는 것은, 자기부정일 뿐만 아니라 촛불혁명의 주역인 대한민국 국민을 우롱하는 처사”라고 설명했다.   바른미래당 이종철 대변인은 논평에서 박 전 대통령의 탄핵 2주년을 앞두고 문재인 정부를 겨냥 “탄핵 2주년에 촛불 정신과 탄핵 정신은 과연 올바로 구현이 되고 있는지 심각한 회의를 던지지않을 수 없다”고 비판했다. 이어 “바른미래당은 문재인 정부 1년10개월 동안 공공기관 임원에 임명된 낙하산·캠코더 인사가 434명에 달한다는 전수 조사 결과를 발표했다”며 “환경부 ‘찍어내기 블랙리스트’를 청와대는 처음에는 보거나 보고받은 적 없다고 하다가 나중에는 대통령의 인사권을 위한 ‘체크리스트’라고 강변했다”고 전했다. 그러면서 “대통령이라는 공무원의 지위와 권한이 국민의 이익이 아니라 ‘내 사람’의 이익을 위해 남용돼서는 안 된다는 헌법재판소 탄핵 취지가 무색하다”며 “정치적 폐습은 과연 청산되었는가. 폐습은 그대로인데 사람만 바뀐 것인가. 아니면 그 진통에도 불구하고 도리어 폐습이 더 깊어진 건가. 지금 국민은 혼란스럽기만 하다”고 덧붙였다.   민주평화당 박주현 수석대변인은 구두 논평을 통해 “탄핵 2주년은 한겨울 내내 한마음으로 공평과 정의의 대한민국을 염원했던 촛불 민심을 다시 되새기는 계기가 되어야 한다”며 “탄핵에 책임 있는 세력이 다시 퇴행적인 행태로 국민을 현혹하면서도, 정부여당에 대한 실망의 반사적 이익을 얻는 잘못된 선거제도가 바뀌어야 탄핵과 촛불혁명의 의미를 살릴 수 있다”고 했다. 이어 “탄핵에 책임 있는 세력이 중심이 된 자유한국당이 선거제 개혁을 노골적으로 방해하면서 의원직 사퇴 운운하는 것에, 촛불민심은 ‘사퇴를 말리지 않는다’는 것”이라고 지적했다.   정의당 정호진 대변인은 논평을 통해 “‘박근혜 사면’을 계속 거론할 거라면, 차라리 ‘도로 친박당’ 간판을 걸어라”고 ‘박근혜 사면론’을 비난했다. 정 대변인은 “한국당 전당대회를 기점으로 탄핵 부정과 최근 황교안 대표와 나경원 원내대표 입에서 거론된 박근혜 사면은 최고 헌법기관의 판결과 촛불혁명의 불복이자 거부”라며 “법적 판결이 진행 중인데 사면 운운하는 것은 친박 제일주의를 드러낸 것”이라고 강조했다.   한영혜 기자 han.younghye@joongang.co.kr","당, 탄핵, 대통령, 사면, 한국, 국민, 박근혜, 박, 촛불, 논평",9,5
2019/03/09,서울신문,정치,"‘박근혜 탄핵 2년’ 민주 “사면론, 국민 우롱”…한국당은 ‘침묵’",http://www.seoul.co.kr/news/newsView.php?id=20190309500040,"박근혜 전 대통령 탄핵 2주년을 하루 앞둔 9일 더불어민주당과 바른미래당, 민주평화당, 정의당 등 여야 4당이 저마다 논평을 내놨다.다만 박 전 대통령의 정치적 고향이라 할 수 있는 자유한국당은 지난해 탄핵 1주년 때와 달리 올해는 공식 논평을 내지 않고 있다.민주당은 한국당 내에서 제기된 ‘박 전 대통령 사면론’을 강하게 비판했다. 바른미래당은 민주당과 한국당을 싸잡아 비판하며 촛불 정신이 제대로 구현되지 않고 있다고 지적했다.민주평화당과 정의당은 한국당을 향해 ‘탄핵 세력의 선거제 개혁 방해’, ‘도로 친박당의 모습’이라고 각각 비판했다.민주당 서재헌 부대변인은 이날 구두 논평에서 “탄핵은 국민들에게도, 우리 역사에도 가슴 아픈 일이었다”면서 “역사적 거울로 삼아 다시는 반복되지 않게 해야 하는데 한국당은 반성하는 모습이 없다”고 밝혔다.그러면서 “한국당은 박 전 대통령에 대해 형이 확정된 경우에만 가능한, 사면을 거론하고 있다”면서 “자기부정일 뿐 아니라 촛불 혁명의 주역인 대한민국 국민을 우롱하는 처사”라고 꼬집었다.이어 “한국당 황교안 대표와 나경원 원내대표가 국민의 지지를 얻기 위한 행보가 아닌 박근혜 지지층 결집만을 위한 역사적 퇴행의 길을 가고 있다”며 “한국당이 국민이 진정으로 원하는 품격있는 건전한 보수 재건의 길을 가기를 촉구한다”고 말했다.한국당은 9일 오후까지 박 전 대통령 탄핵 2년과 관련, 아무런 논평을 내지 않고 침묵했다.지난해 한국당은 “수많은 고통 속에 이뤄진 탄핵 이후, 과연 지금의 대한민국이 탄핵 전보다 무엇이 더 나아졌는지 의문”이라는 논평을 낸 바 있다.그러나 공식 논평 대신 민주당이 지적한 것처럼 최근 황교안 대표, 나경원 원내대표 등 자유한국당 지도부가 ‘박 전 대통령 사면론’을 공개적으로 잇따라 언급했다.황교안 대표는 7일 “박 전 대통령이 오래 구속되어 있고 건강도 나쁘다는 말도 있다”면서 “구속되어 재판이 계속되고 있는 문제에 대해 국민들의 여러 의견들이 감안된 조치가 있으면 좋겠다”고 말했다. 직접적으로 ‘사면’이라는 단어를 언급한 것은 아니지만 사실상 사면에 대한 긍정적 검토가 필요하다는 취지의 발언이다.이에 앞서 나경원 원내대표는 이날 오전 KBS라디오 ‘김경래의 최강시사’에 출연해 “정치적으로 사면 문제를 논의해야 할 때가 되지 않았나 생각한다”면서 “박 전 대통령의 형이 지나치게 높다는 부분에 국민들께서 많이 공감할 것”이라고 말했다. 그러면서 “지금 (사면을) 해야 한다는 말을 드리지는 않겠다. 문재인 대통령이 결단해야 할 때가 곧 오지 않을까 생각한다”고 덧붙였다.바른미래당 이종철 대변인은 논평에서 “한쪽에서는 탄핵 부정 세력이 활개를 치고, 한쪽에서는 슈퍼 ‘내로남불’이 활개를 친다”면서 “탄핵 2주년에 촛불정신과 탄핵 정신은 과연 올바로 구현되고 있는지 심각한 회의를 던지지 않을 수 없다”고 지적했다.그러면서 이른바 ‘환경부 블랙리스트 의혹’을 언급, “대통령이라는 공무원의 지위와 권한이 국민의 이익이 아니라 ‘내 사람’의 이익을 위해 남용되어서는 안 된다는 헌법재판소 탄핵 취지가 무색하다”고 비판했다.민주평화당 박주현 수석대변인은 구두 논평을 통해 “탄핵 2주년은 한겨울 내내 한마음으로 공평과 정의의 대한민국을 염원했던 촛불 민심을 다시 되새기는 계기가 되어야 한다”고 강조했다.그는 “탄핵에 책임 있는 세력이 중심이 된 한국당이 선거제 개혁을 노골적으로 방해하면서 의원직 사퇴 운운한다”면서 “역사를 거스르는 비정상적인 정치에 대해서도 탄핵이 필요하다는 것이 탄핵을 이루어냈던 촛불 민심”이라고 밝혔다.정의당 정호진 대변인은 논평으로 “한국당 황교안 대표와 나경원 원내대표의 입에서 거론된 박근혜 사면은 최고 헌법기관의 판결과 촛불혁명에 대한 불복이자 거부”라면서 “헌법 질서와 국민은 아랑곳하지 않고 ‘친박 제일주의’를 드러낸 것으로 사실상 ‘도로 친박당 선언’”이라고 비판했다.정 대변인은 “한국당이 촛불에 덴 상처를 잊고 친박 세력 규합에 올인한다면 박 전 대통령의 말로와 결코 다르지 않게 모든 것을 한순간에 잃고 말 것”이라고 경고했다.한편 박 전 대통령의 보석(보증금 등 조건을 내건 석방)이나 사면은 모두 법적으로 불가능한 상황이다. 박 전 대통령은 총선 불법 개입 혐의 재판에서 징역 2년을 확정받은 가운데 국정농단 관련 사건 재판과 국정원 특별활동비 상납 사건 관련 재판은 아직 진행 중이기 때문이다.진행 중인 사건과 관련해 보석을 허가받더라도 형이 확정된 사건 때문에 풀려날 수가 없으며, 정치적 사면 조치는 형이 확정된 경우에만 가능하기 때문이다.검사·판사 출신인 자유한국당 지도부가 법리를 모르고 사면을 주장했다기보다 박 전 대통령 지지층을 한국당으로 결집시키기 위한 것으로 정치권은 보고 있다.신진호 기자 sayho@seoul.co.kr","당, 탄핵, 한국, 대통령, 박, 사면, 논평, 국민, 촛불, 정치",9,5
2019/03/09,서울신문,사회,"강남 클럽 ‘아레나’ 실소유주 탈세 의혹…경찰, 국세청에 고발 요청",http://www.seoul.co.kr/news/newsView.php?id=20190309500016,"서울 강남의 유명 클럽 ‘아레나’ 탈세 사건을 수사 중인 경찰이 실소유주로 지목된 강모씨가 탈세의 주범이었던 정황을 포착하고 국세청에 고발을 요청했다.9일 사정당국에 따르면 국세청은 아레나의 조세범 처벌법 위반 혐의를 수사하고 있는 서울 강남경찰서로부터 강씨를 고발해달라는 요청을 접수하고 재조사 필요성과 고발 여부 등을 검토 중이다.강씨는 강남권 일대 유흥업소 10여곳을 운영하는 업계의 ‘큰 손’으로 알려진 인물이다.그러나 자신이 클럽의 실소유주라는 의혹을 부인해왔다. 서류상으로는 아레나 경영권자가 아니기 때문이다.그러나 경찰은 국세청이 고발한 서류상 대표 6명이 강씨의 지시를 받아 움직이는 사실상 ‘바지사장’에 불과하고 실제 탈세를 지시한 것은 강씨였다고 보고 입건 절차에 나섰다.조세범 처벌법 위반 혐의는 국세청 고발이 있어야만 공소 제기가 가능하다. 국세청은 지난해 세무조사 끝에 아레나 대표들을 고발했지만, 강씨는 고발 대상에서 제외됐다.경찰은 또 아레나의 탈세 액수가 당초 국세청 세무조사에서 확인된 260억원보다 훨씬 큰 것으로 보고 있다. 지난 6일 KBS는 경찰이 혐의를 포착한 세금 탈루 규모가 600억원에 이른다고 보도한 바 있다.이 때문에 강씨가 전직 세무 관료를 통해 조사 축소를 목적으로 조사관들을 접촉했는지, 조사 과정에서 문제가 없었는지 확인하기 위해 최근 서울지방국세청 관계자들을 참고인 신분으로 불러 조사했다.강씨는 세무 공무원 및 전·현직 구청 관계자들을 대상으로 전방위 로비를 벌였다는 의혹도 경찰이 수사 중에 있다.한편 아레나는 600억원대 탈세 보도가 나온 지 하루 만인 7일부터 내부 인테리어 공사를 명목으로 영업을 일시 중단한 것으로 전해졌다.신진호 기자 sayho@seoul.co.kr","강, 국세청, 고발, 아레나, 조사, 탈세, 경찰, 세무, 서울, 수사",8,6
