date,press,category,headline,url,text,topics,labels,cnt
2019/03/27,세계일보,정치,박영선 “별장 성폭력·성접대 의혹 동영상 본 적 있다”…황교안 “김학의 전 차관 이야기 기억나지 않는다”,http://www.segye.com/content/html/2019/03/27/20190327516062.html,"박영선 중소벤처기업부 장관 후보자가 과거 국회 법제사법위원장 시절 김학의 전 법무부 차관의 ‘별장 성폭력·성접대 의혹’ 동영상을 본 적 있으며, 당시 국회에서 현 자유한국당 당대표인 황교안 법무부 장관을 만나 이를 언급하며 임명을 만류한 적 있다고 말했다. 박 후보자는 27일 국회 산업통상자원중소벤처기업위원회의 인사청문회에서 이용주 민주평화당 의원으로부터 ""'김학의 전 차관 사건' 당시 법사위원장이었는데 그때 수사가 잘 됐는지, 권력이 비호한 건 아닌지, 성접대 의혹이 밝혀졌어야 했는데 법사위원장으로서 일을 제대로 못 한 것 아니냐""는 질의를 받고 이같이 답했다.  박 후보자는 ""당시 김학의 차관이 임명되기 며칠 전 황교안 법무부 장관이 국회에 온 날, 제가 따로 뵙자고 했다""면서 당시 황 법무장관을 법사위원장실에서 만났다고 말했다. 그는 ""당시 법사위원장으로서 다른 사람보다는 상황이 어떻게 됐는지 좀 소상히 알고 있다""면서 ""오늘은 산업위 청문회이므로 다음번에 소상히 말씀드리겠다""고 설명했다. 송갑석 더불어민주당 의원의 거듭된 질의에 박 후보자는 말을 아끼면서도 ""당시 그 CD를 법사위에서 좀 봤더니 여성이 보기엔 부적절한 CD여서 처음에 좀 보다가 말았다""며 ""그것을 많이 본 분이 박지원 민주평화당 의원""이라고 전했다.  ""황교안 전 장관이 해당 CD에 대해 처음 들어보는 듯한 느낌이었느냐""는 질문이 나오자 박 후보자는 ""(황 전 장관도) 인지하고 계셨다고 저는 생각한다""고 답했다.  이에 대해 황 대표는 국회에서 기자들과 만나 ""CD 동영상은 본 적도 없고, 턱도 없는 소리""라며 ""문제는 박영선 후보자 청문회인데 딴 이야기를 하고 있다""고 반박했다. 그러면서 ""(법무장관으로) 법사위가 열리면 당연히 위원장실에 들린다""면서 ""하지만 (김 전 차관과 관련한 이야기는) 기억이 나지 않는다""라고 밝혔다. 황 대표는 또, 박 후보자가 김 전 차관에 대해 우려를 표명했다는 지적엔 ""제가 장관이 된 뒤 이틀에서 삼일 뒤에 김 전 차관이 임명됐다""면서 ""언제 그런 상황이 있었는지는 기억이 안 나지만 최종적으로 의견을 수렴하는 과정에서 (검증팀으로부터) 검증 결과는 문제가 없었다는 이야기를 들었다""고 덧붙였다.  김현주 기자 hjk@segye.com    [ⓒ 세계일보 & Segye.com, 무단전재 및 재배포 금지]","장관, 후보자, 차관, 당시, 국회, 박, 당, 법사위원장, 황, 법무부",36,10
2019/03/28,중앙일보,정치,하태경 “‘김학의 CD’에 황교안 청문회 됐다…되치기 한판 느낌”,https://news.joins.com/article/olink/23017015,"하태경 바른미래당 최고위원이 27일 박영선 중기벤처기업부 장관 후보자가 청문회에서 당시 법무장관이었던 황교안 자유한국당 대표에게 김학의 전 차관의 별장 성접대‧성폭력 정황이 담긴 CD를 보여주며 차관직 임명을 만류했다는 주장에 대해 “계속해서 문제가 더 커질 것 같다”고 내다봤다.   하 최고위원은 27일 오후 CBS라디오 ‘시사카지정관용입니다’에 출연해 “(김학의 CD 발언 이후) 박영선 청문회가 황교안 청문회로 바뀌겠더라”며 “(박 후보자가) 김학의 사건을 굉장히 구체적으로 알고 있어서 완전히 되치기 한판 느낌”이라고 평했다.   이어 “(법사위원장 시절 박 후보자가 황 장관에 김학의) 임명 전에 CD를 제기하면서 큰 문제가 된다(고 말했다고 주장한다)”며 “반면, 황교안 당시 장관은 기억이 나지 않는다고 말하고 있다. 어쨌든 계속해서 문제가 커질 것 같다”고 말했다.   한국당이 김 전 차관의 의혹 수사에 ‘야당 대표 죽이기’, ‘표적 수사’ 등을 거론하고 있는 데 대해 “김학의 수사를 계속하면 야당 대표가 죽나 보다 생각하는 것 같다”며 “떳떳하면 반대할 이유가 없지 않느냐”고 지적했다.   하 최고위원은 “박 후보자의 제시로 황 대표의 연관성이 높아졌다”며 “(한국당 입장에서는) 더더욱 그걸 (특검을) 반대하면 꿀리는 게 있는 모양이라는 의심을 받게 될 것”이라고 강조했다.   앞서 박 후보자는 국회 산업통상자원중기벤처기업위 인사청문회에서 ‘김 전 차관 사건 당시, 법사위원장이었는데, 역할을 제대로 못한 것 아니냐’는 이용주 민주평화당 의원의 질문에 “(2013년 3월) 황 장관을 법사위원장실로 따로 불러 제보받은 (김 전 차관) CD를 꺼내 보이며 ‘(내용이) 매우 심각하다’며 차관 임명을 만류했다”고 말했다.   그러면서 박 후보자는 “당시 법사위원장으로서 다른 사람보다는 상황이 어떻게 됐는지 소상히 알고 있다”며 “오늘은 산업위 청문회이므로 다음번에 소상히 말씀드리겠다”고 덧붙였다.   이같은 주장에 황 대표는 “택도 없는(어림없다) 소리”라며 “그런 CD는 본 적이 없다. CD를 왜 법사위원장실에서 보느냐”고 반박했다.   황 대표는 당시 법사위원장인 박 후보자와 만난 적이 있느냐는 질문에 “법사위가 열리면 위원장실에는 들렀다”면서도 “하지만 (김 전 차관 관련 얘기를 나눴는지는) 기억이 안 난다”고 말했다.   박 후보자가 우려를 표명했었다는 지적에 대해선 “언제 그런 상황이 있었는지는 기억이 안 나지만 최종적으로 의견을 수렴하는 과정에서 검증 결과는 문제가 없었다”고 해명했다.    박광수 기자 park.kwangsoo@joongang.co.kr","후보자, 박, 대표, 차관, 법사위원장, 당, 장관, 청문회, 당시, 황",36,10
2019/03/27,세계일보,정치,"박영선 폭로 ""김학의 동영상 보고 황교안에게 '일 커진다' 얘기했다""",http://www.segye.com/content/html/2019/03/27/20190327513778.html,"박영선(사진) 중소벤처기업부 장관 후보자는 “과거 김학의 전 법무부 차관의 동영상을 봤고, 이를 황교안 당시 법무부 장관에 얘기했다”고 밝혔다. 박 후보자는 27일 국회 산업통상자원중소벤처기업위원회에서 열린 중소벤처기업부 장관 후보자 인사청문회에서 김 전 차관의 성접대 의혹에 관해 언급했다. 이날 민주평화당 이용주 의원이 박 후보자에게 “김 전 차관이 있을 당시에 (박 후보자는) 법사위원장이었는데, 일을 제대로 못 했다”며 “그때 (김 전 차관 성접대 의혹) 수사가 잘 됐는지, 확인했어야 했다”고 지적했기 때문. 박 후보자는 “김 전 차관이 임명되기 며칠 전 황교안 당시 법무부 장관한테 따로 보자고 했고, 제보받은 동영상 CD를 꺼내 황 장관에게 ‘내가 동영상을 봤는데 몹시 심각해서 이 분이 차관으로 임명되면 일이 몹시 커진다’고 말했었다”고 주장했다. 이어 “(당시)야당 법사위원장이었지만 나라를 걱정하는 마음에 (황 전 장관에게) 따로 얘기했다”고 덧붙였다. 박 후보자는 “당시 상황을 다른 사람보다는 소상히 알고 있다”며 “오늘은 청문회 자리여서 다음에 기회가 되면 소상히 말하겠다”고 밝혔다. 김용준 온라인 뉴스 기자 james1090@segye.com[ⓒ 세계일보 & Segye.com, 무단전재 및 재배포 금지]","후보자, 장관, 차관, 당시, 박, 김, 법무부, 동영상",36,10
2019/03/29,서울신문,정치,"박영선 “黃, 김학의 CD 얘기에 귀까지 빨개져”… 한국당 “법적 조치”",http://www.seoul.co.kr/news/newsView.php?id=20190329004020,"2013년 황교안 국회 방문일정표 등 공개 박지원 “黃, 나보다 앞서 박영선 만났다” 법사위 회의록에도 “金사건 알고 계실 것” 당시 黃 “최대한 조치”… 이젠 “기억 못 해” 곽상도 “朴의원, CD 입수 경위 밝혀라”더불어민주당 소속 박영선 중소벤처기업부 장관 후보자와 민주평화당 박지원 의원이 황교안 자유한국당 대표를 상대로 연일 협공을 펼치고 있다.정치적으로 가까운 사이여서 ‘박(朴)남매’로 불리는 두 의원은 28일 전날에 이어 황 대표가 법무부 장관 시절 김학의 전 법무부 차관의 별장 성폭력 의혹 사건을 알고도 묵인했다는 주장을 거듭 펼치며 황 대표의 반박을 재반박했다. 그러나 황 대표는 두 사람의 주장을 부인했고, 한국당은 박 후보자에 대해 법적 조치를 취하겠다고 밝혔다.박 후보자는 이날 페이스북에 당시 일정표, 관련 법사위 회의 동영상 등을 여러 차례 올리며 “(동영상) CD를 같이 보지는 않았지만 당황해서 얼굴은 물론 귀까지 빨개지며 자리를 뜨던 그날 오후의 황 대표님 모습이 너무나 생생하다”고 했다.박 후보자는 전날 청문회에서 자신이 법사위원장이었던 2013년 3월 당시 법무부 장관인 황 대표를 국회에서 만났고, 그 자리에서 동영상 존재를 언급하며 김 전 차관 임명을 만류했다고 밝혔다.박 후보자와 박 의원은 한국당이 김 전 차관 임명 직전인 3월 11일에서 13일 사이에 황 대표가 국회를 찾아와 만난 근거가 없다고 주장하자 6년 전 일정표를 각각 공개했다. 박 후보자의 일정표에는 ‘3월 13일 오후 4시 40분 법사위원장실, 법무부 장관’이라고 적혀 있다. 박 의원이 공개한 수첩에도 같은 날 오후 5시 15분에 황 대표와 당시 김주현 법무부 기획조정실장을 만나는 약속이 잡혀 있다. 이에 앞서 황 대표는 오후 3시 50분 박병석 국회 부의장도 예방한 것으로 알려졌다.2013년 6월 17일 법사위 전체회의 회의록에서도 박 후보자 주장을 뒷받침하는 발언이 확인된다. 당시 박영선 법사위원장은 황교안 장관에게 “아마 장관님은 김학의 차관과 관련한 여러 가지 사실을 다 알고 계실 것이다. 저희가 그 알고 있다는 사실을 알고 있기 때문에 지금까지 질문하지 않은 것”이라고 했다. 이에 황 장관은 “최대한 조치해 다시 말씀드리도록 하겠다”고 답한 것으로 돼 있다.황 대표는 이날 기자들에게 “당시 박영선 위원장은 여러 번 만났다. 그 과정에서 여러 이야기가 있었는데 그 이야기(김학의 관련)까지는 기억 못한다”며 “중요한 것은 초기 차관 임명 때 검증을 거쳤고 그땐 문제가 없다고 들었다는 것”이라고 했다. 당시 청와대 민정수석이었던 곽상도 한국당 의원은 의원총회에서 “박지원 의원이 어떻게 김학의 동영상 CD를 입수했는지 밝히라”며 반격에 가세했다.손지은 기자 sson@seoul.co.kr서유미 기자 seoym@seoul.co.kr","박, 대표, 황, 의원, 당시, 장관, 후보자, 당, 법무부, 차관",36,10
2019/03/28,한겨레,정치,"박영선, 6년전 일정표·질의 동영상 공개하며 ‘황교안 압박’",http://www.hani.co.kr/arti/politics/politics_general/887850.html,"박영선 중소벤처기업부 장관 후보자가 28일 전날 국회 인사청문회에 이어 연 이틀 ‘김학의 성상납’ 사건과 관련해 황교안 자유한국당 대표를 압박하고 나섰다. 청문회에서 당시 법무부 장관이었던 황 대표에게 김학의 전 법무부 차관의 임명을 만류한 적이 있다고 주장한 데 이어, 이번엔 황 대표를 만났던 당시 구체적 일정표 등을 공개하며 “진실을 말해달라”고 촉구했다.박 후보자는 이날 자신의 페이스북에 “황교안 법무장관님과 만난 일정을 일정파일에서 찾았다”며 ‘2013년 3월13일 16시40분, 법제사법위원장실, 법무부 장관 인사’라고 적힌 일정표를 공개했다. 자유한국당이 황 대표의 법무장관 임명이 3월11일 김 전 차관 임명이 15일 김 전 차관 사퇴가 21일이라는 점을 내세워 ‘11~21일 사이엔 국회 법제사법위원회가 열리지 않아 박 후보자와 황 대표의 만남 자체가 불가능했다’고 주장한 것을 반박한 것이다.공교롭게도 두 사람이 만난 3월13일은 김 차관의 내정 사실을 청와대가 발표한 날이기도 하다. 당시 김행 청와대 대변인이 오후 2시께 내정 사실을 기자들에게 알렸다. 그로부터 2시간40분 뒤인 오후 4시40분께 박 후보자와 황 대표가 만난 셈이다.박 후보자는 2013년 6월17일 국회 법사위 전체회의에서 당시 장관이었던 황 대표에게 질의하는 동영상도 공개하며 “2013년 저는 야당 법사위원장이었지만 대한민국이 발전해야 한다는 성심으로 당시 황 장관님을 존중해드렸다”며 “이제 진실을 말해달라”고 요청했다. 당시 질의 동영상을 보면, 박 후보자는 “아마 장관님은 김학의 차관과 관련한 여러 가지 사실을 다 알고 계실 것이다. 저희가 그 알고 있다는 사실을 알고 있기 때문에 지금까지 질문드리지 않은 것”이라고 말하는 장면이 나온다. 황 대표는 박 후보자가 이런 발언을 하는 동안 눈을 끔벅이며 살짝 고개를 끄덕이는 모습을 보이기도 한다. 박 후보자는 이 동영상 아래에 “시디(CD)를 같이 보지는 않았지만, 당황해서 얼굴은 물론 귀까지 빨개지시면서 자리를 뜨던 그날 오후의 대표님 모습이 너무나 생생하다”는 글을 덧붙였다.한때 ‘박 남매’라고 불릴 정도로 박 후보자와 공조를 해왔던 박지원 민주평화당 의원도 이날 “2013년 3월 당시 박 후보자가 황 대표를 만난 뒤 자신에게 전화를 걸어 ‘황 장관 얼굴이 빨개졌더라’라고 얘기한 사실을 기억한다”고 했다. 또 ‘3월13일 오후 5시15분 황교안 법무장관, 김주현 기조실장 면담’이라고 적힌 자신의 일정수첩을 공개했다. 당시 황 장관이 박영선 법사위원장을 면담한 뒤 35분쯤 뒤에 박지원 의원을 면담한 셈이다. 김주현 당시 법무부 기조실장은 두 의원을 면담한 자리에 모두 배석했다고 한다.또 박 의원은 박 후보자가 황 대표에게 언급했다고 한 시디와 관련해 “제가 2013년 3월 초에 경찰 고위 간부로부터 입수해서 준 것”이라고 설명했다. 한국당은 2013년 3월13일 당시 경찰도 확보하지 못했다던 시디를 박 후보자 등이 확보했다는 것을 믿을 수 없다고 주장했다. 정미경 최고위원은 “제1야당 대표에 대해 ‘아니면 말고’ 식의 허위사실로 공격한 부분은 엄하게 처벌해야 한다”고 목소리를 높였다.이정애 송경화 기자 hongbyul@hani.co.kr","후보자, 대표, 황, 박, 장관, 당시, 차관, 당, 법무부",36,10
2019/03/28,세계일보,정치,"박영선·황교안, ‘김학의 CD’ 진위 공방 치열",http://www.segye.com/content/html/2019/03/28/20190328514381.html,"朴 “黃 당시 얼굴 빨개져” vs 黃 “조응천 수사 왜 안 하나” / 박지원 “내가 朴에 CD 건네” 지원 / 황 “야당만 겨냥… 정치 공세” 맞서박영선(사진) 중소벤처기업부 장관 후보자가 2013년 김학의 전 법무부 차관이 임명되기 전 당시 법무부 장관이었던 황교안 자유한국당 대표에게 ‘김학의 성접대’ 동영상 CD를 거론하며 김 전 차관의 임명을 만류했다는 발언을 놓고 28일 박 후보자와 황 대표 간의 진위 공방이 이어졌다. 박 후보자의 주장이 사실일 경우 황 대표가 김 전 차관의 성접대 의혹을 알고도 묵인한 것으로 볼 수 있어 양측은 팽팽하게 맞섰다.박 후보자는 이날 페이스북에 “저와 (황 전 장관이) 약속한 시간은 2013년 3월13일 오후 4시 40분”이라며 “물론 CD를 같이 보지는 않았지만, 당황해서 얼굴은 물론 귀까지 빨개지면서 자리를 떴던 그날 오후의 대표님 모습이 너무나 생생하다”고 밝혔다. 황 대표가 2013년 3월11일 법무부 장관에 취임하고 4일 뒤인 15일 김 전 차관이 임명되기 전인 13일에 박 후보자와 국회에서 만났다는 것이다. 황 대표는 박 후보자를 만나기 전인 오후 3시 50분에 박병석 국회부의장을 예방한 것으로 알려졌다. 박 후보자와 황 대표의 만남 자리에는 당시 김주현 법무부 기획조정실장이 동석했다.박 후보자에게 김학의 CD를 건넸다고 밝힌 민주평화당 박지원 의원도 “2013년 3월 초 경찰 고위관계자로부터 김학의 CD 동영상과 녹음테이프, 사진을 입수해 당시 법사위원장인 박 후보자에게 줬다”며 “김 전 차관이 임명되기 전 경찰이 내사를 하며 이미 소문이 다 났다”고 거들었다. 황 대표는 이에 대해 “장관이 되고 나서 박 후보자를 자주 만났지만 내가 CD를 보거나 관련된 이야기를 한 적은 없다”고 일축했다. 그는 또 “함께 인사검증 업무를 담당했다가 현재 더불어민주당 국회의원이 된 조응천 전 청와대 공직기강비서관은 빼고 야당 사람들만 수사하려고 한다”며 “정작 사건을 담당했던 채동욱 당시 검찰총장에 대해선 왜 한마디도 안 하느냐. 전형적인 이중 잣대이자 정치공세”라고 말했다. 국회 속기록에 따르면 2013년 6월 17일 당시 박 후보자는 법사위 전체회의에서 황 대표에게 “아마 장관님은 김학의 차관과 관련한 여러 사실을 다 알고 계실 것이다. 저희가 그 알고 있다는 사실을 알고 있기 때문에 지금까지 질문드리지 않은 것”이라고 말했다. 이현미 기자 engine@segye.com[ⓒ 세계일보 & Segye.com, 무단전재 및 재배포 금지]","후보자, 박, 황, 대표, 당시, 장관, 차관, 김학의, 법무부, 임명",36,10
2019/03/28,국민일보,"정치,사회","“오후 4시40분 인사”…박영선, 황교안 만난 ‘3월13일’ 일정표 공개",http://news.kmib.co.kr/article/view.asp?arcid=0013183614&code=61111111&cp=kd,"2013년 6월 17일 국회 법사위 전체회의. 왼쪽부터 박영선 당시 법사위원장, 황교안 법무부 장관. 트위터박영선 중소벤처기업부 장관 후보자가 황교안 자유한국당 대표에게 이른바 ‘김학의 CD’에 대해 알려줬다고 주장하는 날의 일정표를 공개했다. 박 후보자는 28일 “오늘은 쉬고 싶었지만 아침에 사무실에 나와 황 대표와 만난 일정을 일정파일에서 찾았다”며 트위터에 사진을 공개했다. 사진 속 일정표에는 ‘3월 13일 16:40 인사(법사위원장실) 법무부 장관’이라고 적혀있다. 당시 박 후보자는 국회 법제사법위원장, 황 대표는 63대 법무부 장관이었다.박 후보자는 “저와 약속한 시간이 2013년 3월 13일 오후 4시40분”이라고 했다. 이는 황 대표가 2013년 3월 11일 법무부 장관으로 취임한 지 이틀 후였다.박영선 후보자 트위터박 후보자는 약 3개월 뒤에 촬영된 법사위 전체회의 영상도 공개했다. 그는 이 영상에서 “장관님은 김학의 차관과 관련된 여러 가지 사실을 다 알고 계실 것입니다”라며 “저희가 그 알고 있다는 사실을 알고 있기 때문에 지금까지 질문 드리지 않은 것”이라고 했다. 황 대표는 눈을 여러 차례 깜빡이며 고개를 살짝 끄덕였다.박 후보자는 트위터 글에서 “이제 진실을 말해 달라”며 “물론 CD를 같이 보지는 않았다. (그러나) 당황하셔서 얼굴은 물론 귀까지 빨개지며 자리를 뜨시던 그 날 오후의 대표님 모습이 너무나 생생하다”고 말했다.박 후보자는 지난 27일 열린 자신의 인사청문회에서 “김학의 전 법무부 차관의 성범죄 의혹이 불거졌을 당시 법사위원장으로서 검증을 제대로 하지 못한 것 아니냐”는 비판이 나오자 “김 전 차관이 임명되기 며칠 전 장관이었던 황 대표를 만나 CD를 보여줬다”고 주장했다. 그는 황 대표에게 “제가 동영상을 봤는데 이분이 임명되면 굉장히 문제가 커질 것으로 보인다”며 경고했다고 한다.황 대표는 이에 “그런 CD를 본 일이 없다”면서 “김 전 차관에 대해서는 그 당시 ‘검증해 보니 문제가 없다’는 얘기까지만 들었다”고 해명했다. 박 후보자 측은 이후 “황 대표에게 물리적으로 CD를 앞에 꺼내서 보여준 것은 아니고, CD를 가지고 있다고 말했다는 것”이라고 정정했다.또 황 대표가 CD 관련 내용을 보고 받은 적이 없다고 부인한 것에 대해서는 “그것은 거짓말”이라며 “충분히 알아들을 만큼 얘기했다. 제가 먼저 만나자고 했고 황 대표가 법사위원장실로 왔다. 만났던 장면이 너무나 또렷이 기억난다”고 강조했다.김 전 차관은 2013년 3월 성접대 의혹이 불거지며 임명 6일 만에 차관직에서 물러났다. 수년 전 강원도 원주 소재의 한 별장에서 건설업자 윤중천(58)씨로부터 성 접대를 받은 의혹이었다.경찰은 수사 끝에 기소 의견으로 김 전 차관을 검찰에 송치했지만 무혐의 처분이 났다. 결국 피해 여성이 직접 나서 2014년 7월 김 전 차관과 윤씨를 검찰에 고소했다. 피해자에 따르면 별장에 왔던 여성은 30명 정도로, 윤씨는 여성들에게 폭력을 휘두르고 ‘최음제’ 등 약물을 사용해 김 전 차관과의 성관계를 강요했다.성 접대 동영상은 모두 4개가 존재하는 것으로 알려졌다. CD에 저장된 최초 촬영본을 휴대전화 카메라로 다시 찍고, 이를 다시 CD에 저장하는 식으로 복사된 것으로 모두 같은 영상이다. 이 중에는 등장하는 남성이 누구인지 특정할 수 있을 정도로 화질이 좋은 영상도 있다고 한다.현재 대검찰청 과거사 진상조사단이 사건을 재조사 중이다. 더불어민주당 의원들은 김 전 차관의 직속 상관이었던 황 대표가 당시 사건 내막을 몰랐을 리 없다며 강하게 비판하고 있다.박은주 기자 wn1247@kmib.co.kr","대표, 황, 차관, 후보자, 장관, 박, 김, 당시, 법무부, 법사위원장",36,10
